{
  "$schema": "https://json-schema.org/draft/2020-12/schema",
  "$id": "https://praetore.io/schemas/exam-question.json",
  "title": "SpringExamQuestion",
  "description": "Eén meerkeuzevraag voor de Spring Exam ELO-quiz. Genereer instinkers (exam traps), geen trivia. Taal: Nederlands. Antwoord-ids moeten voorkomen in choices.",
  "type": "object",
  "additionalProperties": false,
  "required": ["id", "topic", "difficulty", "elo", "type", "prompt", "choices", "answer", "explanation"],
  "properties": {
    "id": {
      "type": "string",
      "minLength": 1,
      "description": "Unieke kebab-case id, bij voorkeur {topic}-{kort-onderwerp} (bijv. data-jpa-derived-query)."
    },
    "topic": {
      "type": "string",
      "enum": ["ioc", "aop", "transactions", "mvc", "testing", "security", "boot", "data"],
      "description": "ioc=Core/DI/scopes; aop=AOP; transactions=@Transactional; mvc=Web/MVC; testing=tests/slices; security=Security; boot=Boot/Actuator/autoconfig; data=JDBC + Spring Data JPA."
    },
    "difficulty": {
      "type": "integer",
      "minimum": 1,
      "maximum": 5,
      "description": "1=basis, 3=typische examenvraag, 5=subtiele edge-case."
    },
    "elo": {
      "type": "integer",
      "minimum": 0,
      "description": "Start-ELO van de vraag; vaak ~700+difficulty*100 (bijv. diff 3 → ~1000)."
    },
    "type": {
      "type": "string",
      "enum": ["single", "multi", "code"],
      "description": "single=één juist; multi=meerdere juist (answer is array); code=vraag met code-snippet (zet code-veld)."
    },
    "prompt": {
      "type": "string",
      "minLength": 1,
      "description": "Vraagtekst zonder spoiler van het juiste antwoord."
    },
    "code": {
      "type": "string",
      "description": "Optioneel; verplicht praktisch bij type=code. Korte, leesbare Java/config-snippet."
    },
    "choices": {
      "type": "array",
      "minItems": 2,
      "maxItems": 6,
      "description": "Meestal 4 keuzes (a–d). Precies één juist bij single/code; bij multi ≥2 juist.",
      "items": {
        "type": "object",
        "additionalProperties": false,
        "required": ["id", "text"],
        "properties": {
          "id": {
            "type": "string",
            "minLength": 1,
            "description": "Korte id, meestal a/b/c/d."
          },
          "text": {
            "type": "string",
            "minLength": 1
          }
        }
      }
    },
    "answer": {
      "description": "Juiste choice-id (string) of array van ids bij multi. Moet matchen met choices[].id.",
      "oneOf": [
        { "type": "string", "minLength": 1 },
        {
          "type": "array",
          "minItems": 1,
          "items": { "type": "string", "minLength": 1 }
        }
      ]
    },
    "explanation": {
      "type": "string",
      "minLength": 1,
      "description": "Waarom het juiste antwoord klopt (1–3 zinnen)."
    },
    "trap": {
      "type": "string",
      "description": "Welke verkeerde aanname/instinker afleidt — verplicht bij exam-gerichte vragen."
    }
  }
}
